<?xml version="1.0" encoding="utf-8" ?>

<!DOCTYPE protein SYSTEM "protein.dtd">

<protdataset>
	<protein>
		<nazwa>Białko Rieskego</nazwa>
		<ID>Q9ZR03</ID>
		<gene>PetC</gene>
		<organism>Arabidopsis Thaliana</organism>
	</protein>

	<function>
		<molecular>
			Wiązanie centrum żelazowo-siarkowego
		</molecular>

		<molecular>
			Transport elektronów 
		</molecular>

		<molecular>
			Wiązanie jonów metali
		</molecular>

		<molecular>
			Reduktaza cytochromu c
		</molecular>

		<biological>
			Czynny udział w fotosyntetycznym transporcie elektronów
		</biological>

		<biological>
			Mechanizm obronny rośliny przed nadmierną ilością promieniowania słonecznego
		</biological>

		<biological>
			Optymalizowanie wydajności procesu fotosyntezy
		</biological>
	</function>

	<localisation>
		<tissue>Liść</tissue>
		<subcell>Chloroplasty</subcell>
		<subcell>Tylakoidy</subcell>
		<subcell>Błona tylakoidów</subcell>
	</localisation>

	<sequence>
		<nucleotide>
			GTTGCCTTGTACTAGCTCTTACACCTGAGCTCCACTATTTTATAGCACAATGGCCATGCT
			GTCCTCCCGCCGTGTGGCCGCCCCGGCCAAGGCTTCGGCCATTCGCCGCTCGCGCGTTAT
			GCCGGTGGTGCGCGCTGCCGCTGCCTCGTCGGAGGTGCCCGACATGAACAAGCGCAACAT
			CATGAACCTGATCCTGGCTGGTGGCGCTGGTCTGCCCATCACCACCCTGGCTCTGGGCTA
			CGGTGCCTTCTTCGTGCCCCCCAGCTCTGGCGGTGGCGGCGGTGGCCAGGCCGCTAAGGA
			CGCTCTGGGCAACGACATCAAGGCCGGGGAGTGGCTGAAGACCCACCTGGCTGGTGACCG
			CTCGCTGTCCCAGGGCCTGAAGGGTGACCCCACCTACCTGATCGTCACCGCCGACAGCAC
			CATCGAGAAGTACGGCCTGAACGCCGTGTGCACTCACCTGGGCTGCGTCGTGCCTTGGGT
			GGCGGCCGAGAACAAGTTCAAGTGCCCTTGCCACGGCTCTCAGTACAACGCTGAGGGCAA
			GGTGGTCCGTGGCCCCGCTCCCCTGTCGCTGGCCCTGGCCCACTGCGACGTGGCTGAGTC
			TGGCCTGGTCACCTTCTCCACCTGGACGGAGACTGACTTCCGTACCGGCCTGGAGCCCTG
			GTGGGCGTAAATCCGCTCCTGCTACTGCCGCGTTTTGACGGCGCAGCTGCTACAGCCGCG
			GCCCGCGTGTTGATTGTCTCTCTCAGCCAGGCCGCTTCGGCGGCGGCCACGTTCGCTGCT
			GGTGAAGCAGTGGACGCGGGGGCGGGAGGCCGGAGCGTGGAGCTGCGGCGGCAGCAGCAG
			CGGCGCCAGGCAGTGCTGGGCGTGTCGCTTGTACGTTGTTGCTGATGAGTGGAGGAGATG
			ACAAGGGCGGGAGCAGAGCAGGAGGGCCTGGGGGCAGCGTCTGCCGGCCGTGCGCACCGG
			ACCCTGGCCGCCACGGAGGAAGTTTTGGTTCCGGGCGCCGTCGCGCTCTTACGCGCGGGC
			GCCTTTTCTGTGGCGTACCCAGGGGAATTTTTAGCGTGCCGCGGTCTGGTGCATAGGGGC
			GCGTGTGGGGCGCTAGCGCGTCCCGTGGCGGCGGGCCGAATGGCCGTGTCGCCCACCCGC
			AGCGCTCCTTTGCCAGGGTGTGCCGACCCGGCACGCGGGCGTGTTACGTTTCGGGCTCTG
			AGCGGGCGGTTGCTGTGTCGGTGTGGGTTTGGCACCGGACGTAGCGGCGTGGCACTGGGC
			GTCGCGATGAGGGAGAGTGGAGAAGACTTCAGAGATTATTGCGTTAGTGCATTTGATGCA
			AATTAAGAGTCGATGCCTCTCGGGCGGCGGGCCTGGTGCTGCCGCCGGGGGCGGGTGCCA
			TGTGAATGCTGCGCCGTGCCCGCGGCGGACGCATGCGCCTGTAACTCGGAAGAACC
		</nucleotide>
		<aminoacids>
			MASSSLSPATQLGSSRSALMAMSSGLFVKPTKMNHQMVRKEKIGLRISCQASSIPADRVP
			DMEKRKTLNLLLLGALSLPTGYMLVPYATFFVPPGTGGGGGGTPAKDALGNDVVAAEWLK
			THGPGDRTLTQGLKGDPTYLVVENDKTLATYGINAVCTHLGCVVPWNKAENKFLCPCHGS
			QYNAQGRVVRGPAPLSLALAHADIDEAGKVLFVPWVETDFRTGDAPWWS
		</aminoacids>
	</sequence>

	<structures>
		<first src="first.png" alt="first_alt.png"></first>
		<second src="second.png" alt="second_alt.png"></second>
		<third src="third.png" alt="third_alt.png"></third>
		<fourth src="fourth.png" alt="fourth_alt.png"></fourth>
	</structures>

</protdataset>